{
  "created_at": "2026-06-11T23:45:00Z",
  "expected_checks": [
    "schemas_valid",
    "manifest_signature",
    "valid_permit_verifies",
    "invalid_permit_denied",
    "ledger_verifies",
    "checkpoint_verifies",
    "anchor_verifies",
    "trust_checkpoint_signature",
    "trust_checkpoint_verifies",
    "consumed_permit_verifies",
    "validation_report_hash_matches",
    "tampered_artifact_fails"
  ],
  "files": {
    "TRANSCRIPT.md": "30b2449cd71f81391bdf233eb6c1ac28f806a13f7ac80699bf31965d284ba38e",
    "VALIDATION_REPORT.md": "c517aa1889fd469f231467c0e9e3da7982465ad1aae4eca25935039b1fcf430b",
    "anchor-public-key.txt": "6c311dd98ccb72a0a284a8aed017c7b38caa3f60837d287fe40c904bd78dd39c",
    "anchor.json": "a3c9d93893520d1911c3c9c781d45c1002b687ce0ca0916538172d9616e4e3c3",
    "checkpoint-public-key.txt": "23caf603b19ff01acefb056aa681756f5541c1a689d34dd7506d4b27ae24d635",
    "consumption-receipt.json": "3e75d3c2d918cf4d9e6e9b5ea2705994d6c20bc9909abe9b68124ed027f1dcea",
    "executor-public-key.txt": "75f566d4726fee12c087cae4625dc9f136dfccbf013446bdec12658c2e92574d",
    "invalid-permit.json": "6eb32217d94b63a4259bb5641b6b85f8835b8b5b7443319bf0ef851af23588b6",
    "manifest-public-key.txt": "e49f1ae516e0c4aef31caf80621a588c36a1b45568d55449e7bf446bc5296d4c",
    "permit-context.json": "8b3e493735caed9d64b1896c810f607954510debdff9c7f75c4fd31520463216",
    "permit-trust-checkpoint.json": "ab9f8f7616fa951998c72b936162759186b3fb256f49ee3a46525edf36ef8b87",
    "proofrail-checkpoint.json": "1ad118d1f027db801980e367fcd78a8c84777879118235823c59e1bba59a9484",
    "proofrail-ledger.jsonl": "6704a4b906ef40a4ed450847f4a6da8da70cdebe25c7c686e676be8f96650a8d",
    "replay-registry.sqlite3": "20312165d54d32fb1d4ec6e0695776afcbc702740149bd406d84efcff09303bb",
    "tampered-ledger.jsonl": "c3e257c0682f2f82ca407e52a088485fb6db96251df338d44155d207ad5ad8e3",
    "trust-checkpoint-public-key.txt": "abbe44e6eb3f9a7c9c3e285f068471f5b0c734ca191c9acef85fac79dc3f2440",
    "trust-checkpoint.json": "c47f4b88bf113f63f966903f58921a7444e6421ee6bdb43e3e3685d9cc2590ba",
    "valid-permit.json": "a8299dfbe50131d71509af9440ec0b6d0733b851130399677a7e4289de7c8ad4",
    "validation-results.json": "88d765b6319cb2431b78a854b242a9bf333d66b7d0808853c224f07b168704ff",
    "verifier-public-key.txt": "be1f31c5a57b5096660744a493712a6ca08f60b3ba942d0e525c5503a03ce10f"
  },
  "kind": "proofrail.reproduction-manifest.v0.5.2",
  "record_hash": "3e98f19a735e7f0f0fdc777defc02c655ce07749039e6b09c12de28195eaf1ef",
  "signature": {
    "algorithm": "ed25519",
    "key_id": "reproduce-manifest",
    "value": "kn2d_SXJsl0hc_ZfbzcEOnktTBq9oNyL4McCgzlJDddXli60YAjQyadbe7nAdAM97rYNwkBXh1IYFoDGvo9PBQ"
  },
  "validation_report_sha256": "c517aa1889fd469f231467c0e9e3da7982465ad1aae4eca25935039b1fcf430b"
}
